{"status":"proposed","marker":"aicadia-state-live-20260815T074701Z-20977-26929","place_revision":"shared-non-null-confirmed","proposals":[{"id":"one","direction":"Pip tests the stone arch with one deliberate footfall and listens to the returning echo.","grounding":"Pip is alone beneath the Echo Arch, whose stone returns each footfall; Pip currently has no established properties or traits."},{"id":"two","direction":"Pip traces a small ash mark on the stone to distinguish this moment from the next echo.","grounding":"Pip is an ash-dusted frog at the bare Echo Arch, with no other local subject present and no current properties or traits."},{"id":"three","direction":"Pip settles motionless beneath the arch and waits to learn whether any sound arrives without a new footfall.","grounding":"The Echo Arch is defined by returning footfalls, the recent record contains only Pip’s arrival, and Pip’s current state is empty."}]}